{"approved":true,"date":"2023-04-01","description":"Votação 200-1","governmentOrientation":null,"id":"200-1","organ":"CCJC","proposition":null,"sourceUrl":"https://dadosabertos.camara.leg.br/api/v2/votacoes/200-1","tallies":{"no":0,"others":0,"yes":2},"votes":[{"deputyId":101,"party":"PT","vote":"Sim"},{"deputyId":102,"party":"PT","vote":"Sim"}]}
