{"approved":null,"date":"2024-09-01","description":"Votação 100-3","governmentOrientation":null,"id":"100-3","organ":"PLEN","proposition":null,"sourceUrl":"https://dadosabertos.camara.leg.br/api/v2/votacoes/100-3","tallies":{"no":0,"others":0,"yes":0},"votes":[{"deputyId":101,"party":"PT","vote":""}]}
